full_text,sentimen
"Kasihan karywan pabrik sparepart , karena mobil.listrik cuman sedikit komponen nya dan jarang servis<br><br>Otomatis usaha mekanik juga akan mati / menurun secara perlahan<br><br>Mgkin yg masih survive cuman tambal ban dan cuci motor<br><br>Lain2 nya gimana ?",Negatif
"Indonesia luas dgn lautnya untuk membuat PLTA, dan sekarang juga nikel indonesia jadi dambaan dunia jadi bahan batrainya. <br>Saya siap beli mobil listrik jika 2 faktor itu d jadikan secepat mungkin. <br>Bahkan indonesia akan jadi negara yg paling pertama yg menetapkan mobil listrik.",Positif
"Nissan Leaf listrik ini dijual sejak 2010 dan menjadi mobil listrik terbanyak terjal didunia sebelum tesla mengglobal, tp karena krisis CEOnya jadi merusak transisi nissan ke mobil listrik.",Positif
"RT @KompasTV: Intensif Pembelian Kendaraan Listrik Cair 20 Maret, Akankah Subsidi Ini Berefek Positif? https://t.co/V4Auk939je",Negatif
Direktur CORE: Insentif Kendaraan Listrik Harus Dibarengi dengan Kesiapan Industri Dalam Negeri https://t.co/CW9NQnoIPa,Positif
"Pertanyaannya sekarang, mengapa pemerintah memberikan subsidi justru untuk kendaraan pribadi dan bukan melakukan transformasi kendaraan umum ke kendaraan listrik? https://t.co/ns6OyEQSsE https://t.co/DODcegUBrC",Negatif
Beli Kendaraan Listrik Bisa Dapat Insentif Pemerintah? https://t.co/5I1nqGyHH2,Netral
RT @Gagak_Rimang_: Berkembangnya industri dan meningkatnya kebutuhan kendaraan listrik global disebut KSP @Dr_Moeldoko sebagai potensi,Positif
RT @jijilubis: Isu lingkungan dan perkembangan teknologi ancam ambisi kendaraan listrik berbasis nikel Indonesia.,Negatif
Menperin Pastikan Subsidi Kendaraan Listrik Cair 20 Maret 2023 : Okezone Economy https://t.co/2Ty4GuqMd8,Positif
RT @pertamina: Pertamina dukung upaya percepatan pembangunan ekosistem kendaraan bermotor listrik berbasis baterai (KBLBB),Positif
Dipertanyakan Sumber Dana Subsidi Kendaraan Listrik Pemerintah https://t.co/j4I6fbzBGJ,Netral
@energitodayID @pertamina @KemenBUMN Kendaraan motor listrik sekarang didukung pertamina NRE semangat menuju energi bersih,Positif
@energitodayID @pertamina @KemenBUMN Masyarakat harus banget nih nanti kedepannya ikut pakai kendaraan listrik juga seperti motor listrik. Biar nanti percepatan bangsa ini mencapai NZE bisa semakin cepat,Positif
"RT @aliefwikarta: Subsidi kendaraan listrik dapat mempercepat adopsi kendaraan ramah lingkungan, tetapi juga memunculkan pro dan kontra",Positif
@energitodayID @pertamina @KemenBUMN Kita nantikan kemajuan kendaraan listrik di Indonesia dengan terus didukung oleh Pertamina NRE demi tercapainya Net Zero Emission pada tahun 2060,Positif
"Sumbar telah Punya 3 Charging Station, Persiapkan Ekosistem Kendaraan Listrik https://t.co/9Swn4I0All",Positif
Skema insentif untuk mobil listrik akan berbeda dengan motor listrik. https://t.co/a8pb8Yrpjj,Netral
Saham Saham Nikel !! Trend Kendaraan Listrik sudah mulai bergerak https://t.co/rf7IEoUufJ via @YouTube,Positif
RT @CNNIndonesia: Beli Rumah dan Kendaraan Listrik di IKN Tak Kena PPN dan PPnBM https://t.co/BuwoWp57E3,Positif
"RT @korantempo: Setelah muncul keputusan pemblokiran anggaran kementerian, pemerintah justru mengeluarkan kebijakan yang malah membebani",Negatif
RT @PartaiSocmed: Alih teknologi kendaraan listrik yg sesungguhnya itu justru dilakukan oleh Pak Dahlan Iskan dkk. Tp mrk malah dikriminalisasi,Negatif
"RT @CNNIndonesia: Pemerintah resmi memberi subsidi motor listrik mulai 20 Maret, baik untuk pembelian baru maupun konversi.",Positif
"@YRadianto @ekowboy2 @musniumar Woy Buzzer Dungu Luknut Kritik, Aki2 Luhut ngasih subsidi buat kendaraan listrik hanya untuk memperkaya Orang Asing .",Negatif
RT @asumsico: Pemerintah resmi mengumumkan subsidi bagi konsumen pembeli kendaraan listrik. Subsidi diberikan untuk motor listrik dan mobil listrik,Positif
RT @detikcom: Pemerintah memberikan insentif kendaraan listrik mulai 20 Maret 2023. Lima merek yang dapat subsidi antara lain Hyundai dan Wuling,Positif
"Selain mempermudah masyarakat dalam membeli dan mendukung produsen kendaraan listrik, insentif ini juga menjadi stimulus untuk menarik investasi masuk ke Indonesia. https://t.co/4BeO8jbTjx",Positif
RT @korantempo: Pemerintah mengucurkan subsidi melalui produsen kendaraan listrik. Demi menggenjot penjualan dan menarik minat investor ,Positif
Bismillah tahun ini punya kendaraan listrik,Positif
"Daripada mensubsidi kendaraan listrik, kenapa tidak diprioritaskan  buat perbaikan angkutan masal lebih dahulu. Setelah bagus  baru fokus kendaraan listrik pribadi.",Netral
"@alisyarief Kendaraan yg memakai listrik hanya bisa dijalan aspal, bila masih memakai bbm setelah Baterai-nya habis!! lbih baik yg biasa, biar tidk ruwet di Perjalanan: Kndaraan memakai baterai blum layak utk di RI karena faktor ekonomi & Jalannya Ngeri & bangsa ini masih jauh dari sejahtera",Netral
"Lithium merupakan komponen penting dalam pembuatan baterai di kendaraan listrik (electric vehicle/EV) dan baterai-baterai yang dapat diisi ulang seperti yang digunakan di ponsel. Jika berita deposit lithium ini benar, maka komoditas ini dapat menjadi penyelamat ekonomi Iran.",Netral
RT @faridgaban: Mari kita dukung pemerintah ngasih subsidi buat orang kaya dan pabrik kendaraan listrik milik perusahaan China,Netral
"Kerek Populasi Kendaraan Listrik, Pemerintah Diminta Contek Thailand https://t.co/07UGj0Amqk",Netral
@ibnu_AbdulManan @Ndons_Back Nantinya kan mau di bikin seperti minyak tanah ke gas waktu jaman SBY dulu bang. tunggu aja kendaraan listrik 5 tahun kedepan bang. skrg aja yg lg di galakkan di ojol dulu.,Netral
"Pemerintah akan memberi subsidi kendaraan listrik untuk masyarakat mulai 20 Maret. Khusus motor listrik, angkanya ditentukan sebesar 7 juta rupiah per unit. Namun teknis untuk subsidi mobil listrik belum ditentukan. https://t.co/ns6OyEQkD6 https://t.co/rrIagyMyyQ",Positif
"@PNS_Ababil @KemenkeuRI IKN butuh bnyk duit, apalagi duit buat subsidi kendaraan listrik",Netral
"RT @YogyakartaCity: Pemda DIY Berencana Melarang Bus Wisata Masuk Kota Jogja, Wisatawan Akan Diangkut Kendaraan Listrik https://t.co/sBoJ0r�",Positif
"Indonesia Meniru Norwegia, Soal Dukungan Pada Kendaraan Listrik https://t.co/QLqyfGpRSu",Positif
RT @giginpraginanto: Gak sulit menebak asal duitnya. Kalau gak bank BUMN ya China yang kendaraan listriknya sudah banyak mondar-mandir di jalanan,Netral
RT @Konfrontasi_co: Indef Minta Pemerintah Terbuka tentang Kriteria TKDN Kendaraan Listrik https://t.co/tFcwfFMEi6,Positif
"Terima kasih mba Ratna ?Krn sifatnya bukan force majeure, kebijakan pemberian insentif kendaraan listrik yg gunakan trilyunan uang rakyat harusnya dibahas dgn DPR, Banggar dan Komisi terkait. https://t.co/7hDhVOPzus",Negatif
@keuangannews_id Eeiitt daahh kemarin lihat di tv lagi giat dengan mobil dan motor listrik (subsidi)???  setelah PCR terbitlah kendaraan listrik,Negatif
@Moeldoko: Industri Kendaraan Listrik RI Bisa Seperti UMKM https://t.co/erAWP4h05D,Positif
@geloraco PPP telat ngomong terlanjuran LBP dah promosi di seluruh NUSANTARA soal subsidi kendaraan listrik. Ye tapi gak apa daripada mingkem.,Negatif
OJK menerbitkan empat insentif setelah pemerintah mengumumkan besaran bantuan yang diberikan untuk membeli kendaraan listrik. https://t.co/9GZvMAoN9W,Positif
Pemerintah akan Bebaskan Pajak Pertambahan Nilai Bagi Kendaraan Listrik https://t.co/piAQT3l0Qj,Negatif
Jalan pintas mewujudkan ekosistem kendaraan listrik melalui subsidi https://t.co/TkwJ4C8sDt,Positif
SUBSIDI SESAT KENDARAAN LISTRIK... Pemberian subsidi dan insentif pada akhirnya hanya menguntungkan produsen kendaraan listrik https://t.co/bzKyQ4xQ6Z,Negatif
Pemerintah bebaskan PPN kendaraan listrik domestik terdaftar di IKN https://t.co/DPsfdapsfY https://t.co/RDe6xoDc4u,Positif
Diskon Rp 7 Juta Dorong Kepemilikan Kendaraan Listrik di Indonesia https://t.co/PKD0g8SkIU,Positif
Pemerintah Bebaskan� PPn Kendaraan Listrik Produksi Dalam Negeri di�IKN https://t.co/sG0d5UWCip,Netral
RT @DPP_PKB: �Harus kita kawal implementasinya. Jangan sampai subsidi ke kendaraan listrik mengurangi apalagi mencabut subsidi untuk kendaraan lain,Netral
PR Besar Jokowi Jadikan RI Produsen Kendaraan Listrik Dunia https://t.co/jcLfMRjKRT,Netral
"Tweeps, Sekjen PBB menyebut kesetaraan gender baru akan terwujud 300 tahun lagi. Sementara, mulai 20 Maret, pemerintah RI akan memberikan insentif untuk pembelian kendaraan bermotor listrik berbasis baterai (KBLBB) https://t.co/tqtCpA25LW",Netral
"RT @tempodotco: Subsidi Kendaraan Listrik Berlaku Mulai 20 Maret 2023, Berikut Daftar Harga Mobil Listrik di Indonesia https://t.co/CWPD7s6",Netral
"RT @kompascom: Kebijakan insentif kendaraan listrik sebaiknya diarahkan ke transportasi umum, bukan kendaraan pribadi. https://t.co/3HtUMPV",Netral
Ga akan terurai kemacetan negeri ini kalo semua orang pake kendaraan listrik. https://t.co/2egkZX68Dl,Negatif
Moeldoko Ungkap Pemicu & Pemacu Industri Kendaraan Listrik RI https://t.co/dhB08OFLew,Netral
Aman! Ada 3 Stasiun Pengisian Kendaraan Listrik PLN di Soloraya https://t.co/IiOFF1LvHb,Positif
"RT @IDFreeport: Dalam upaya mengurangi emisi karbon, pemerintah Indonesia melakukan berbagai upaya antara lain mendorong terbentuknya ekosistem dengan pengadaan kendaraan listrik di indonesia",Positif
"Di lain sisi, PT Merdeka Copper Gold Tbk (MDKA) sebagai emiten yang memproduksi komponen kendaraan listrik juga ketiban untung. Pasalnya, permintaan nikel yang meningkat bakal menyumbang hingga lebih dari 72% pendapatan emiten ini.",Positif
"Pemerintah resmi mensubsidi kendaraan listrik khususnya roda dua sebesar Rp7 juta per kendaraan. Dalam waktu dekat, atau tepatnya 20 Maret 2023, beberapa motor listrik yang diamanatkan undang-undang untuk disubsidi bakal jadi lebih terjangkau. https://t.co/YBPFd8v9m1",Positif
"Ternyata, Pemerintah Belum Bahas dengan DPR Soal Subsidi Rp 7 Juta untuk Kendaraan Listrik https://t.co/aiFfjj86rE",Netral
RT @plnsumbar: PLN berkomitmen penuh mendukung upaya pemerintah dalam percepatan ekosistem kendaraan listrik di tanah air.,Positif
Era Elektrifikasi Toyota Siapkan Varian Kendaraan Listrik https://t.co/d9ln1eIOcF,Positif
Toyota Yakin Indonesia Bisa Jadi Pemain Inti Kendaraan�Listrik https://t.co/3g03nuxaNa,Positif
"Ada Subsidi Mobil Listrik, Saatnya Beralih ke Kendaraan Non-BBM� https://t.co/neJMEAAj1X",Positif
Insentif terkait pembelian dan pengembangan industri hulu kendaraan listrik. https://t.co/bs6tbH3mAc,Positif
Insentif Kendaraan Listrik Kontraproduktif dan Rawan Kecurangan https://t.co/hPqwFBRbfL,Netral
RT @Ndons_Back: Promo dapat subsidi nanti giliran rame kendaraan listrik ribut lagi berebut batre atau ribut ngecas,Netral
@savicali Setuju pak. Tp transportasi umum jkt-detabek jg perlu dimaksimalkan lagi. Bukan malah kendaraan listrik PRIBADI yg disubsidi,Negatif
Harga beberapa motor listrik akan menjadi lebih murah pada 20 Maret 2023. Hal itu karena pemerintah resmi memberikan insentif atau subsidi kendaraan listrik. https://t.co/uTyNWd0ZuQ,Positif
@mantriss Kebijakan subsidi kendaraan listrik tidak berpihak pd pengurangan kemacetan. Hanya memikirkan pengusahan berbulu pejembut akal luhut dan muldoko,Negatif
"@mantriss Uang subsidi kendaraan listrik batalkan, buat bangun kendaraan umum murah dr pinggiran jakarta.",Negatif
"Pemerintah Dorong Ekosistem Kendaraan Listrik, Menperin Yakin Bakal Tarik Investasi https://t.co/iXA2mYaTGG",Positif
"Mobil Hybrid Innova Zenix, Almaz Tak Dapat Subsidi Kendaraan Listrik https://t.co/wAH16Tgrju",Negatif
Era Elektrifikasi Toyota Sediakan Ragam Varian Kendaraan Listrik https://t.co/HWgvfZTyoP,Positif
"Pada saat pembelian kendaraan listrik mendapatkan layanan pemasangan ???? ???????? secara gratis dari PLN. Untuk daya listrik minimum, PLN menyarankan untuk melakukan pengisian daya kendaraan listrik di rumah minimal 7.700 Volt Ampere (VA) untuk mobil.",Positif
"Electrizen, PLN terus memberikan kemudahan bagi pengguna kendaraan listrik atau ???????? ??????? (EV), salah satunya melalui layanan pengisian daya kendaraan listrik di rumah ???? ????????. https://t.co/otJwM80F76",Netral
"@msaid_didu Boleh jadi subsidi kendaraan listrik ibarat melihat tulisan diskon 50% tapi harganya telah di markup sebelum dijual, uang negara akan masuk ke kantong pengusaha berkedok subsidi, apalagi biaya produksi motor tamiya lebih murah",Negatif
"Kita patut curiga Kerjasama dengan Tesla hanya akal2an Luhut untuk memuluskan usaha miliknya sendiri dalam bidang Energi dan juga Subsidi pada kendaraan listrik itu hanya modus semata untuk mengambil uang negara demi kerajaan bisnisnya, jadi wajar saja Luhut melawan OTT @KPK_RI. https://t.co/2Dp5zgRCFH https://t.co/bCCJna5n0S",Negatif
"Pemerintah Beri Subsidi Kendaraan Listrik, Cak Imin: Harus Kita Kawal https://t.co/G9pinTmvZs",Netral
Wuling Berharap Insentif Kendaraan Listrik Mampu Tingkatkan Penjualan Wuling Air�Ev https://t.co/QKYhXVZPNG,Positif
RT @Penjejakbumi01: @msaid_didu Goto emang lagi rugi ni kan lumayan bisa menutupi kerugian nya selama ini lewat jualan kendaraan listrik,Netral
Menteri Perindustrian Agus Gumiwang Kartasasmita menyatakan kebijakan potongan harga untuk membeli kendaraan listrik dinilai dapat menarik investor. https://t.co/WOWqg2eLOV,Positif
"Usai Membuka Milik Rafael, PPATK Diingatkan Rekening Pejabat Pensiunan Jenderal Produsen Kendaraan Listrik dengan Aset Tak Terkira https://t.co/pRHG5dWQdo",Negatif
"Tahun ini, pemerintah mengalokasikan dana insentif untuk 250 ribu kendaraan listrik, masing-masing Rp7 juta. Dananya dari mana? Jangan khawatir, sudah disiapkan. Direktur Jenderal Anggaran Kementerian Keuangan (Kemenkeu), Isa Rachmatarwata mengatakan,� https://t.co/7eALccLVNu",Positif
@tempodotco Bukannya dia yg menyusun RAPBD 2023 yg mencantumkan pembelian kendaraan listrik?? Knp juga dia yg menolak??,Netral
"Proses penyusunan kebijakannya tanpa pertimbangan logis. Kendaraan listrik bukan untuk menyelamatkan lingkungan, tapi untuk keselamatan industri otomotif. https://t.co/o5xExKyDrD",Netral
"Drama lucu kendaraan listrik.., akan banyak orang2 nuntun kendaraan cari2 colokan listrik!, lagi pula jutaan motor bensin mo di buang kemana?.., baterai tahan 8 th?, Seperti nya mirip batre hp,awal nya saja kuat,lama2 cuma kuat 5 meter!..? https://t.co/sCpoKSCxcy",Negatif
Limbah batre fix sangat berbahaya krn beracun. Ini batre kecil2 ukurannya. Gimana kalau batre motor atau mobil listrik yg size nya itu sangat besar. Kelolah sampah aja msh gak bener jakarta. Sanggup ngolah sampah batre dr kendaraan ev ? Semoga cerdas yaa guys ? https://t.co/sqCghTmLVv,Negatif
@PRFMnews Kendaraan listrik buat nanjak di puncak bisa ga sih?,Netral
@tunnov @JohnySibuea @Hegie_bae @CHOKYPARHAS @Bang_Muun @Rakha_boumi Awalnya bpk DuluI berfikir saat teknologi engine kita sdh tdk bisa mengejar jepang dkk.Maka ada satu kesempatan biar kita sama- start yaitu kendaraan listrik.Tapi akhir cerita bkn yg lahir,Netral
@sutanmangara Mantap nih jika satu saat udah kendaraan listrik semua kalo ada yg mau demo kelak tinggal pln matiin listrik jd pada diem di rumah?,Netral
Kemenkeu mencarikan anggaran untuk program insentif kendaraan listrik agar bisa berjalan mulai 20 Maret 2023. Dari mana sumbernya? https://t.co/BUwbSxvk5Z,Positif
"OJK Beri Sederet Insentif untuk Kembangakan Kendaraan Listrik, Apa Saja? https://t.co/S3AZ4DfTEV",Positif
Pemerintah Targetkan Penerima Insentif Kendaraan Listrik Pelaku UMKM https://t.co/RDskrbOHXF,Positif
"Dengan adanya subsidi ini, maka pembelian kendaraan listrik baik motor maupun mobil akan diatur. Seperti apa? https://t.co/y1mLOPtd3J",Netral
"Di Asia Tenggara, pangsa pasar kendaraan listrik baru 2 persen pada 2022, sedangkan di Eropa dan China mencapai 20 dan 25 persen. https://t.co/4rFVgGHHi7",Netral
RT @CNNIndonesia: Sederet Insentif OJK Buat Beli hingga Kembangkan Kendaraan Listrik https://t.co/pjpDoNKYIT,Positif
@sutanmangara Bener2 gk setuju sama program kendaraan listrik gw,Negatif
OJK Luncurkan Empat Insentif Dukung Pengembangan Kendaraan Listrik https://t.co/Ar52aNfUWt,Positif
BKPM memastikan bahwa sejumlah investasi jumbo terkait baterai kendaraan listrik akan dapat direalisasikan pada 2024. https://t.co/LOiwrSJkNV,Positif
Indef: Pakai Kendaraan Listrik Berpotensi Hemat Pengeluaran Rumah Tangga https://t.co/4m0yb9UTeG,Positif
Pemprov Jawa Barat Sewa 22 Mobil Listrik Untuk Kendaraan�Dinas https://t.co/Xw08gBCWJI,Positif
"@yo2thok @jokowi Bukannya perbanyak mass rapid transportation. Kok malah dikasih motor listrik, yg justru meningkatkan penggunaan kendaraan pribadi dan kemacetan",Negatif
RT @kumparan: Pemerintah akan memberikan bantuan kepada untuk kendaraan bermotor listrik berbasis baterai (KBLBB) senilai Rp 7 juta per unit,Positif
PLN Fokus Bangun Tempat Pengisian Daya Kendaraan Listrik https://t.co/FDiST70zpk,Positif
RT @1hsan: @OposisiCerdas Orang kaya dikasi subsidi...orang miskin dicabut subsidinya..memang keren kalian pejabat pemerintah.,Netral
"@musniumar Pak retor terbodoh, sebaiknya lu diam kalau ga tau masalahnya. Seluruh dunia lagi berusaha utk tidak bergantung pada bahan bakar minyak. Tujuannya agar mengurangi polusi udara. Caranya yaitu kendaraan liatrik. Semoga lu dan keluarga lu ga beli",Netral
"@OposisiCerdas Subsidi kendaraan listrik dilangar pemerintah  dan UU APBN dalam hal ini Menko Marves, Menke dan Presiden !",Negatif
Menperin: Bantuan subsidi kendaraan listrik bisa tarik minat investor https://t.co/lmT56im6qa,Positif
@BangEdiii Kebutuhan rakyat atas listrik n bbm dicabut subsidinya... dialihkan ke org kaya yg mampu beli kendaraan listrik...sungguh keputusan yg cerdas...karna ado opung dibalik industri mobil listrik,Negatif
"Penguatan industri baterai menjadi kunci utama percepatan kendaraan listrik. Selain itu, keterjangkauan harga menjadi salah satu tantangan utama https://t.co/HJAl9YngU5",Positif
Dana Subsidi Kendaraan Listrik Bakal Diambil dari Anggaran BUN https://t.co/BIEOlW3f2D,Positif
"5/6: Kendaraan listrik memiliki fitur-fitur canggih seperti regenerasi energi saat pengereman, yang dapat mengubah energi kinetik menjadi energi listrik untuk mengisi ulang baterai. Selain itu, juga penggunaan teknologi AI dalam pengaturan daya baterai dan pengelolaan energi",Positif
4/6: Kendaraan listrik juga lebih sunyi saat berjalan karena tidak menggunakan mesin pembakaran internal yang bising. Hal ini membuat pengemudi dan penumpang dapat menikmati perjalanan yang lebih nyaman dan tenang.,Positif
3/6: Kendaraan listrik juga memiliki efisiensi yang lebih tinggi dibandingkan kendaraan konvensional. Konversi energi listrik ke tenaga mekanik pada motor listrik lebih efisien daripada mesin pembakaran dalam pada kendaraan konvensional.,Positif
"2/6: Selain ramah lingkungan, kendaraan listrik juga lebih hemat bahan bakar karena menggunakan listrik sebagai sumber energi, yang harganya lebih stabil dan terjangkau dibandingkan bahan bakar minyak yang harganya cenderung naik",Positif
"Kacau Nih, Ternyata Pemerintah Belum Bahas dengan DPR Soal Subsidi Rp 7 Juta untuk Kendaraan Listrik https://t.co/lZEnEaVfYD",Netral
"RI Kasih Diskon Beli Kendaraan Listrik, Investor Bakal Antre Bikin Pabrik    https://t.co/pP7sqaEMJu https://t.co/x3LSlSRADa",Positif
"Pilih MPV, Pj Gubernur DKI Heru Budi Hartono Tolak Mobil Listrik: Pj Gubernur DKI Heru Budi Hartono lebih memilih Toyota Innova Venturer ketimbang menggunakan mobil listrik sebagai kendaraan dinasnya. https://t.co/GUYJ2dY68h https://t.co/5izeZqUGPN",Netral
"Beri Subsidi untuk Kendaraan Listrik, Indonesia Mau Kalahkan Thailand https://t.co/ADCgBt8RvQ",Positif
Tahun ini pemerintah memberikan subsidi kepada 200 ribu motor listrik. https://t.co/hp22hjjkU4,Positif
Populasi kendaraan bermotor berbahan bakar minyak masih mendominasi. https://t.co/LRfJKTNzMS,Netral
Percepatan Ekosistem Baterai Genjot Jumlah Kendaraan Listrik https://t.co/ibBf1Cave4,Positif
Subsidi Kendaraan Listrik Bakal Pakai Duit Sisa Anggaran Pemerintah https://t.co/w0pemapcw9,Netral
Pemerintah disarankan beri insentif konversi kendaraan listrik https://t.co/imE2dT0JhR,Netral
PLN berkomitmen penuh mendukung upaya pemerintah dalam percepatan ekosistem kendaraan listrik di tanah air. Hal itu salah satunya diwujudkan dengan menghadirkan kapal listrik di kawasan Ampiang Parak yang dikelola oleh Laskar Pemuda Peduli Lingkungan (LPPL) Amping Parak. https://t.co/9W6096Kpcg,Positif
Pemerintah Optimis Subsidi Kendaraan Listrik Bakal Genjot Penerimaan Pajak https://t.co/SuJnkVUZrP,Positif
"@yo2thok Betul,,bullshit kendaraan listrik ramah lingkungan, cman mindah sisi polusi ke pembangkit listrik,,dampak pencemaran alam dr batery dll jg lebih berbahaya....kecuali kendaraan berbhaan bakar hidrogen mungkin ramah lingkungan..wkwk",Negatif
@adriansyahyasin Kapan nih LRT Cibubur beroperasi? @kemenhub151 subsidi kendaraan listrik g dialokasikan buat transportasi umum?,Negatif
@msaid_didu Subsidi diberikan kepada rakyat yang membeli kendaraan listrik. Supaya tidak menggunakan BBM subsidi dan untuk partisipasi mengatasi global warming.,Positif
"@susipudjiastuti si opung gencar banget promosikan kendaraan listrik sampai mau ngasih subsidi segala,apa jangan2 dia yg punya pabriknya?tp menurutku sih aneh,orang yang beli mobil listrik kan org berduit knp jg harus disubsidi,,gk habis pikir aku",Negatif
"TKDN lebih dari 40%, Volta dapat insentif kendaraan listrik | Indotelko https://t.co/rCRDs0d0pe",Positif
"Luhut Ingin Penjualan Kendaraan BBM Dibatasi, Beralih ke Listrik https://t.co/nLysywhQT5",Positif
"Kendaraan Listrik Kian Digandrungi, Mutifinance Siap Dukung? https://t.co/jDN3I2YaFZ",Negatif
@musniumar Semakin banyak kendaraan yg menggunakan listrik maka bahan bakar berbasis migas akan berkurang karena migas kita impor..udara juga lebih bersih..professor koq malah ngak ngerti...itu Smart Phone tolong di gunakan dgn benar..byk googling dan b,Positif
"RT @infosemar3: Saatnya beralih ke energi bersih, kendaraan listrik lebih murah dengan subsidi dan kurangi emisi karbon https://t.co/SXvFzl",Positif
Kebijakan subsidi kendaraan listrik ini berpotensi hanya memiliki dampak jangka pendek bagi saham-saham terkait. https://t.co/NWWaYWFxpA,Negatif
RT @KompasTV: Luhut Yakin Negosiasi dengan Tesla Makin Lancar Setelah Ada Insentif Kendaraan Listrik https://t.co/IkTuL6STuM,Positif
"RT @bascolia: @PartaiSocmed Kendaraan dari BBM fosil beralih ke listrik dengan dalih lebih hemat, lingkungan, oke diterima. ",Negatif
"@musniumar Eh taik, Pemerintah mendorong era peralihan teknologi baru dari kendaraan berbahan bakar minyak menjadi kendaraan bermotor listrik berbasis baterai (KBLBB). Peralihan teknologi baru tsb menciptakan peluang bagi Indonesia",Negatif
"@PRFMnews Klo ekonomi keluarga warga Jawa Barat semapan kang @ridwankamil pasti akan lbh mudah utk mengajak beralih ke kendaraan listrik.. klo ngajak mah emang mudah, tp liat dulu ekonomi yg diajaknya.. mudah bagi kang @ridwankamil tp apakah akan mudah jg bagi masayrakat yang diajak",Netral
Pemerintah baru saja meluncurkan kebijakan mengenai subsidi kendaraan listrik yang mulai berlaku 20 Maret 2023 https://t.co/AdXkkX7ckk,Positif
"Bupati Tuban Aditya Halindra Faridzky, menyampaikan untuk pengadaan kendaraan atau mobil dinas listrik pada tahun 2023 ini masih belum ada. https://t.co/2LvtEzBDJ7",Negatif
Insentif Kendaraan Listrik Harus Didukung Infrastruktur SPKLU https://t.co/Kk7QKcqDxf,Positif
"smelter ini nantinya akan menghasilkan perak dan emas batangan karena ada fasilitas precious metal refinery (PMR) serta nikel, almunium, lithum dan cobalt yang merupakan bagian dari ekosistem kendaraan listrik",Positif
Warga jabar mah ngan butuh kendaraan umum yg murah layak dan saling terintegrasi AJG. NAON BEDANA BERALIH KE LISTRIK KLO TETEP KREDIT AJG. https://t.co/5i61J52QSt,Negatif
Sinergi kedua BUMN ini dilakukan guna mengakselerasi tumbuhnya kendaraan listrik. https://t.co/mXYwEslR9r,Positif
"di indonesia lagi urgensi kriminalitas, tapi yang buru-buru banget disubsidi malah kendaraan listrik :)",Negatif
@Gank_Of_Petojo Klo ada himbauan pemerintah kita harus berhemat/ekonomi sulit apakah kita percaya. Pemikiran logic manusia akan memenuhi kebutuhan primer dulu (sembako) daripada kendaraan listrik entah itu masuk kebutuhan (sekunder/Lux).,Negatif
@ridwanhr hedeeh..PLN makin gede kepala nih...waspada gaess!!!!! bentar lagi era kendaraan listrik!!!! apapun....semua akan bergantung pada listrik.....dan PLN jagonya????????????????????????,Negatif
"SEBENTAR LAGI, KENDARAAN LISTRIK RESMI DISUBSIDI https://t.co/dzychZNRUt",Positif
RT @PRFMnews: Ini Upaya yang Dilakukan Pemprov Jabar untuk Ajak Warga Gunakan Kendaraan Listrik https://t.co/JUvYASggP7,Positif
Waspada! Subsidi Ganda Bantuan Pembelian Kendaraan Listrik https://t.co/PgtTT2uUTi,Negatif
@Srikandi10wulan Sikap pemerintah terkait meningkatkan kendaraan listrik kita dukung,Positif
@Srikandi10wulan Manfaat kendaraan listrik sangat diharapkan baik adanya dinegara kita,Positif
RT @andinie: Kendaraan listrik ini sptnya cuan bgt utk oknum pejabat tertentu sampai udah gak penting lg ngurus bahan pangan terjangkau,Netral
RT @Srikandi10wulan: Indonesia maju dan berkembang terkait kendaraan listrik...hal yang terus kita dukung pemerintah. https://t.co/aB1LdB3d�,Positif
Bangun industri kendaraan listrik dengan semakin berkembang,Positif
Kendaraan Listrik berkembang baik,Positif
"Pemerintah melalui Kementerian Energi dan Sumber Daya Mineral memastikan mampu menghemat anggaran pemerintah mencapai Rp32,7 miliar dari rencana pemerintah dalam pemberian bantuan insentif kendaraan listrik melalui  konversi motor dari BBM ke listrik. https://t.co/ns6OyEQkD6 https://t.co/cSrgbIfTra",Positif
"rakyat 1/2 politik ?..kendaraan listrik merupakan kendaraan yg sangat sederhana bagi org yg banyak duit, tapi bagi org engk punya duit hanya berpikir tiap bulannya listrik berapa?.. dan untuk hidup sehari- hari bagaimana?..politik santuy yg berkeadilan..",Netral
