full_text,sentimen
Anis taunya hanya omdo dan komplain. masi ingat pernyataan anis agar air tdk di buang ke laut namun di masukkan ke bumi? Lihat lah hasil kerjanya dan exsekusi nya amburadul. Anis nol tindakan dan exsekusi namun pandai bicara dan ngibulin.,Negatif
"?? MANTAPS, COCOK BUAT BAJAK TANAH SAYA DISAWAH",Negatif
"Ya ga aneh, klo orang pemerintah bau mulutnya sama, bau tai kebo. Jelas polusi EV rendah, tp pulusi buat batere, polusi buat listrik, ga dihitung ma ente2 mulut bau kebo. Subsidi tuk orang kaya beli mobil. Bau kebo Lo",Negatif
"Hahahaha, pengen mobil listrik nya laku, tapi sayang disubsidi untuk orang kaya, masih adakah keadilan di negeri ini?",Negatif
Nasib Esemka bagaimana??,Netral
harga hyundai ionic5 masih  lumayan tinggi,Negatif
Kedepanya pemerintah harus lebih membangun sumber listriknaya dahulu sama2 negara maju dan berkembang seperti bedungan sepeti di china dan tenaga fusi bila perlu kalau udah terlelisasi ada pondasinya baru di gerkana yang lainya dari listrik.,Netral
yg. bilang emisi dari batre perkapita?????? fix pengem hidup d zaman purba,Netral
"?? mobil listrik katakan lah muat 2 orang?? nah untuk 1 keluarga butuh 2 atau 3 mobil listrik.berapa yang di butuh kan jika jakarta mayoritas mobil listrik semua,sepertinya stak jakarta tak bisa bergerak?????? bukan lagi macet tapi menjadi padat tak merayap",Negatif
"cuma PEMUJA PENJILAT bokong luhut moeldoko yg BANGGA dgn IKLAN BODONG SUBSIDI mobil PRIBADI IMPOR bisa tekan polusi udara. <br>udah jelas tujuan SUBSIDI utk membangun hype DEMAND SESAAT,<br>BUKAN utk investasi SUSTAINED GREEN ENERGY.",Negatif
Harus produksi di Indonesia jangan negara luar yang produksi..,Positif
"Yang di kritik anis kan pemberian subsidi kendaraan listrik itu sendiri yang di rasa anis tidak tepat. Lebih baik subsidi itu untuk pupuk petani, nelayan, umkm itu akan jauh bermanfaat menggerakkan ekonomi kerakyatan. Subsidi itu hanya akan memperkaya korporasi2 pemain kendaraan listrik. Jauh dari slogan jokowi yang selalu mendorong umkm ekonomi kerakyatan. Lucu bukan. ENTAHLAH ??",Netral
"@Varen Auriga Yurioshi kan benar kata kamu baik subsidi di alihkan ke lain,,, padahal duit subsidi ya ga ada yg keluar buat subsidi mobil listrik,,, cuma pajak ya yg di potong,,,jd apa ya d alihkan tu juga pemarintah masih dpt dr 1% di kali banyak dr yg beli atau 11% tp ga banyak yg beli.",Negatif
"@Varen Auriga Yurioshi logika ya kalau ga d diskon apa kah org akan banyak beli mobil listrik ya,,,,kalau ga banyak yg beli di mana datang ya subsidi buat petani ya....????",Negatif
"masalah ya subsidi mobil listrik ga keluar uang,, cuma pajak ppn yg 11% jadi 1 % .... jd pemarintah ga keluar uang",Negatif
"yg dilupakan orang� yg ga setuju subsidi mobil listrik adalah subsidi ga serta merta pokok mobil listrik tapi baru 2 mobil aja Wuling Air EV dan Hyundai Ioniq 5 yg udah TKDN, yg terbanyak adalah motor dimana user nya ya masyarakat menengah. selain itu ga semua orang juga yg beli EV bersubsidi otomatis dapat subsidi tapi ada kriteria nya. dibandingkan subsidi bbm justru subsidi EV malah lebih tepat sasaran tapi mungkin ini juga yg ditakuti karena kalau EV jalan otomatis subsidi bbm dicabut",Positif
proyek baru jangan diiringi koruptor baru...,Positif
"Subsidi untuk si kaya. harusnya sih fokus ke public transportation. Perbanyak rute, perbanyak kuantitas, tingkatkan kenyamanan, perbanyak sosialisasi.<br><br><br>Tapi ya tapi",Positif
Ketar ketir Ada bisnis menggiurkan di kndraan listrik,Netral
Memang Proses pembuatan baterai tidak menghasilkan CO2....,Negatif
"Jgn kan pembuatan batrai, Setau saya Semua enegi yg keluar menghasil kan co2 om,",Negatif
Efektif mengurangi beban subsidi BBM 500T lebih pertahun,Positif
akhirnya bisa menikmati udara kota yg bersih sambil macet-macetan ??<br>kapan transportasi publiknya ??,Negatif
menunggu hasil hitungan anies berapa pastinya gas buang dari kendaraan listrik,Negatif
"ngga ngaruh banyak dari bebas polusi, yang paling buruk pabrik-pabrik nya yang beroperasi tanpa henti belum lagi buang limbah ke sungai",Negatif
Sebaiknya dahulukan fasilitas publiknya dulu sebagai penggeraknya,Netral
@Orang Awam Gak membantu sih. Masih aja macet dan tercemar alam,Negatif
Walaupun efektif tdk perlu disubsidi krn pemakainya org kaya semua,Negatif
Maju terus Indonesia ????,Positif
"tetap juga tak bagus untuk alam sekitar, produksi sekala besar-besaran akan menimbulkan masalah baru pada bumi, lama-lama sumber nickel pun akan habis untuk buat battery, bekas battery yg rosak akan menjadi sampah pada alam sekitar, the best solution perbanyakanya public transport period!!!!",Negatif
"Polusi udara bisa ditekan dengan penanaman pohon, penghijauan di sepanjang pinggir jalan.",Positif
"Fakta : emisi carbon mobil listrik 96 gram/km-passanger, emisi carbon bus bensin 60 gram/km-passanger jadi sktr 30% lebih rendah drpd emisi mobil listrik. Guna mengurangi polusi udara, Jabodetabek dan Indonesia seharusnya lebh mendorong orang pindah ke public transport drpd pindah ke mobil listrik dgn mensubsidi mobil listrik yg menggunakan uang pajak rakyat. Kebijakan cacat gini lahir dari pejabat yg merangkap pengusaha. Sumber TNMT/ Financial Times. zzxxx",Negatif
"<b>Buzer penjilat kelebihan bayar gaa akan ngerti manfaatnya subsidi mobil listrik</b><br><br>Buzer buzer kelebihan bayar alias maling uang rakyat <br>Tidak ingin Indonesia maju mereka cuma ingin berkuasa bisa maling lagi seperti di Jakarta dan rakyat jadi korban <br><br>Rakyat Indonesia tidak butuh capres abal2, karbitan, kelebihan bayar",Negatif
"Pajak kita malah untuk subsidi buat orang kaya beli mobil,mending buat subsidi sembako,gas,bbm,listrik",Negatif
Gimana cara kang ngurangi itu kalo pembangkit listriknya masih berbahan bakar fosil dan batu bara?????? iya kalo pembangkit listriknya pakek nuklir pasti itu sangat efisien pakek kendaraan listrik,Negatif
Keluarkan inpres agar mobil plat merah yang baru harus pake mobil listrik. Agar cepat pemakaian secara masal mobil listrik.,Netral
Mafia baru : ah ada kerjaan tambahan,Negatif
sebaiknya subsidi berikan pada orang miskin bukan untuk orang orang mampu/ kaya dan utamakan kendaraan umum agar jalan jalan tidak bertambah macet dan amburadul,Netral
itu subsidi untuk pajak mobil doang pak.. jadi pemerintah gak ngeluarin duit untuk menanggung pembelian mobilnya,Positif
"Fakta : emisi carbon mobil listrik 96 gram/km-passanger, emisi carbon bus bensin 60 gram/km-passanger jadi sktr 30% lebih rendah drpd emisi mobil listrik. Guna mengurangi polusi udara, Jabodetabek dan Indonesia seharusnya lebh mendorong orang pindah ke public transport drpd pindah ke mobil listrik dgn mensubsidi mobil listrik yg menggunakan uang pajak rakyat. Kebijakan cacat gini lahir dari pejabat yg merangkap pengusaha. Sumber TNMT/ Financial Times. zzccc",Netral
menjanjikan utk masa dpn dgn catatan..<br>1. daya tempuh baterai jauh <br>2. merata tempat pengisian baterai<br>3. cepatnya pengisian baterai spt kita melakukan di pom bensin ( waktu pengisiannya lbh cepat lbh bgs )<br>4. Harga terjangkau / kompetitif <br>5. jgn dipaksakan klo ke 4 diatas blm terpenuhi..maukah membeli mobil hanya utk dlm kota? harganya juga ga murah...pengisian baterai jg msh lama ( hanya kalangan tertentu yg mau beli bukan masyarakat pd umumnya ),Netral
Sebenernya mobil listrik cocok bgt dipakek di indonesia yang indah ini,Positif
Sebenarnya sih aku masih lebih percaya lebih ngefek ganti sumber energi ke energi terbarukan daripada cuma ganti kendaraan listrik. kalau pembangkit listriknya masih batu-bara ya sama aja,Netral
harusnya pembangkit listriknya pakai tenaga nuklir karena cuma itu doang yg efektif dan murah,Negatif
"@Social Justice Warrior betul. klo orng berfikir bisa tangkap pesan saya, memang saya tidak mendukung kebijakan subsidi ini. tidak tepat sasaran. bedanya dengan orde baru salah satunya adalah melegalkan ""kejahatan"" melalui kebijakan.",Negatif
@Social Justice Warrior buat nambah lowongan kerja juga.. bayangin Indonesia menjadi negara terbesar di dunia pembuat baterai?,Positif
"@Yogi Jaelani Lebih baik ya kita bareng2 akui saja, kalau ""subsidi mobil listrik� itu ya cuma utk bangun industri ekstraktif terbaru, eksploitasi baru dan hilirisasi baru. Mainan baru penguasa yg merangkap pengusaha. Enak begitu terang2an ga punya malu. Bahkan Orde Baru saja ga gitu� amat..",Negatif
Setuju. Memang seharusnya sumber energinya dulu dibarukan baru end user nya. <br>Seperti di negara negara eropa. Transformasi energy dari sumbernya terlebih dahulu.,Positif
Yah... semoga aja ini lancar tanpa ada hambatan dan korupsi,Positif
Memang industri mobil listrik sudah siap 100%?,Netral
Belum lah namanya juga baru mulai 5% aja sepertinya belum nyampe,Negatif
Halah produk asing aja bangga giliran ada anak bangsa mau mengawali mobil listrik tdk dukung dasar pecinta asing,Negatif
Banyak orang tdk mau perubahan dan nyaman dengan kondisi menurut mereka nyaman.... Pola pikir yg dirubah.... Butuh aturan subsidi listrik dan penambahan pajak tambahan bagi pengguna kendaraan fosil agar merubah masyarakat dengan aturan berganti ke kendaraan energi listrik,Positif
@Sunan Giri dasar dari mana karbon mobil listrik muncul seperti itu.... Aneh....,Negatif
"@Yohanes Wibawa Fakta : emisi carbon mobil listrik 96 gram/km-passanger, emisi carbon bus bensin 60 gram/km-passanger jadi sktr 30% lebih rendah drpd emisi mobil listrik. Guna mengurangi polusi udara, Jabodetabek dan Indonesia seharusnya lebh mendorong orang pindah ke public transport drpd pindah ke mobil listrik dgn mensubsidi mobil listrik yg menggunakan uang pajak rakyat. Kebijakan cacat gini lahir dari pejabat yg merangkap pengusaha. Sumber TNMT/ Financial Times. zzz",Negatif
Lu udah punya  motor mobil listrik belum,Negatif
pakai tenaga surya aja di batesin.,Netral
"Kenapa pada mara kalau disentil anis tentang supsidi terhadap mobil listrik apa lagi rata2 orang yg berduit, bukan berasal dari orang2 yg kurang mampu,  karna subsidinya kuran tepat, uang negara sudah terbatas banyak pinjaman malah dipakai supsidi buat sikaya",Negatif
"Jangan bicara miskin atau kaya,yg dibicarakan disini adalah org yg biasa pakai mobil menggunakan mobil berbahan bakar minyak bumi beralih ke mobil yg cuma pakai batrai sehingga polusi dari gas buang mobil konvensional bisa ditekan,bagi orang yg belum mampu beli mobil listrik ya maka yg dilakukan adalah mengganti angkot atau bus dari berbahan bakar minyak fosil jadi pakai batrai listrik,calon presiden jagoanmu itu otaknya nggak ada jadi cari calon lainya aja biar nggak nyesel nanti",Negatif
"Banyak yg ingin menjegal industri mobil listrik di RI terutama para pelaku bisnis di kendaraan konvensional dan perusahaan lain yg akan berpengaruh, tapi pak jokowi dan jajarannya akan terus jalan dan melaju kencang demi kebaikan indonesia??",Positif
"Jokowi adalah anugerah Indonesia, ide2nya brilian dan spektakuler, tepat waktu, anti mangkrak",Negatif
Ngumpulin duit pajak dari rakyat sudah banyak kasih subsidi ke orang kaya kan goblok,Negatif
Aku dukung Jokowi dan jajarannya jalan terus...tinggalkan moblis dan mobben....jalan terus ya!,Netral
@jendral ini tuh komennya pk logika.... g ky buzzer yg pnting nyablak....wkwkwk,Negatif
"50 Juta Dapat Mobil Listrik,, aku akan beli :) Mobil Listrik untuk beli Galon Air :)",Negatif
"Asap dari kendaraan besin dan solar salah satu pemicu kanker terbesar, jadi memang harus ada jalan lain ??",Positif
Cobalah kpan semua full subsidi yg katanya SDA melimpah,Positif
"Ayolah pindah NUKLIR, kayak di Turki gitu loh. Nuklir halal koq hukumnya, bisa di sah kan nanti sama MUI. Koq malu2 sih.... Indonesia ini gak punya sungai2 raksasa seperti China, Russia, Brazil atau Ethiopia jadi sulit invest di hidropower, sungainya kecil2..... Soal panas bumi, oke Indonesia memang banyak, tapi sekali lagi terlalu tersebar dan kecil2 kapasitasnya serta terletak dekat dengan sumber gempa (gunung berapi) menyebabkan investor takut dengan tinggi nya resiko. Sedangkan nuklir bisa ditaruh dimanapun yang dirasa aman, hasil listriknya besar, bisa nyala 24/7 selama berpuluh2 tahun, murah pula.",Negatif
"@Social Justice Warrior betul, itu hanyalah skema akal2an elit ekonomi dan pemerintah untuk menunjukkan bahwa mereka melakukan sesuatu dengan masalah perubahan iklim. Sok hijau dan ramah lingkungan. Kalo emang mau mengurangi emisi karbon: 1. Tutup semua PLTU batu bara dan ganti dengan PLTN atau energi terbarukan, 2. Naikkan pajak kendaraan pribadi dan galakkan transportasi umum yg aman, nyaman, dan tersedia di mana2,  3. Baru pikirkan soal kendaraan listrik pribadi. Ini tidak. Malah kendaraan pribadi duluan yg dikasih subsidi!",Negatif
@Taufik Mampuk tenang .... ada 11.000 T di kantong nya Jokowi .... beres ituuu,Negatif
"Utang PLN aja 45 Trliun, jangan mimpi nambah utang dulu lah. PLN harus jual asset2 nya yang tidak perlu, tanah2, gedung2 yang kosong tidak dipakai , untuk bayar utang nya dulu..",Negatif
"@Kapten Hiu Lebih baik ya kita bareng2 akui saja, kalau ""subsidi mobil listrik� itu ya cuma utk bangun industri ekstraktif terbaru, eksploitasi baru dan hilirisasi baru. Mainan baru penguasa yg merangkap pengusaha. Enak begitu terang2an ga punya malu. Bahkan Orde Baru saja ga gitu� amat.. zzz",Negatif
Coba diinformasikan polusi dampak dari alam yang diambil energi dan limbahnya... Apakah memindahkan polusi,Positif
"Bilang aja disuruh negara asing menjual kan produk orang asing dan dengan modus Indonesia membuat mobil produk buatan Indonesia dan mengatasi polusi <br>Dan pemerintah jokowi bangga dengan produk korea<br><br>Pemerintah itu kan budhak pemerintah Korea <br>Disuruh membuat kaya orang asing , soal membuat kaya orang Indonessia jangan dulu, orang Korea dan china dulu yang dibuat kaya, nanti kalau Indonesia nanti aja dan gak boleh lebih kaya dari mereka <br>Tolol pemerintah jokowi dan tolol mahluk Indonesia",Negatif
Proyek tetaplah proyek.....walaupun itu walaupun  dipoles dengan beraneka ragam nama,Negatif
"@S???? ... Jaman pasti berubah bro....teknologi harus tetap berkembang...yang slaah adalah, adanya kesempatan untuk berkorupsi ria untuk para pejabat, di saat adanya proyek baru tsb,  dengan  mengatas namakan  masyarakat, teknologi, dll",Positif
"Ya zaman terus berubah, tehnologi makin berkembang. Gini aja ngk paham drun drun.",Positif
KALAU MAU ADIL SEMUA ANGKUTAN UMUM DULU YG DI DAHULUKAN,Netral
Yg dikritik subsidi mobil listriknya bukan mobil listriknya,Netral
SELAMA BATU BARA MASIH MENJADI TULANG PUNGGUNG LISTRIK. SUBSIDI TDK TEPAT SASARAN.,Negatif
"hedehhh, gk bbm, gk PLN tetap aja dibilang tidak tepat sasaran wkwkwkwk. <br>padahal orang kaya pun bayar pajak, jadi berhak menikmati subsidi lah, yang tidak tepat sasaran itu orang miskin yg tidak bayar pajak tapi menikmati subsidi cuakkks",Positif
TUNJUKKAN KEJUJURAN DAN URAT MALU MU UTK MENJAWAB PERTANYAAN DIATAS,Negatif
Mobil litrik mahal trus g efektip coba klo hbis batre di jln gmna tar di setut pake motor Kya mobilnya Ridwan Hanif klo mobil bensin hbis bensin g kwatir biar bgemna lbih baik mobil bensin,Negatif
"Pemain lama hrs betransformasi. Pemain baru hrs terus berinovasi.  Sdh banyak contohnya Perusahaan yg tdk mengikuti jaman .    Alhasil     ditinggalkan konsumen .      Nama2   TOYOTA, SUZUKI,  HONDA , NISSAN , MAZDA         10 Thn lagi   tak ubahnya  spt  NOKIA,  KODAK , BLACKBERRY.   kl mereka  bersikukuh  dgn CARBON NEUTRAL.",Positif
"Dilarang mobil bbm itu budaya yg dipaksakan atau penjajahan oleh rezim otoriter, harusnya sediakan kendaraan non bbm yg lebih menguntungkan, dg sendirinya akan beralih ke kendaraan non bbm.",Positif
"itu nanti solusi pemerintah gimana yah pak? kira2? dengan banyak masyarakat yg masih banyak punya mbil bensin? apakah lngsung di stop larang smuaa? btw bukan nya ada nanti ada proses adaptasi juga? dari konvensional, trs proses tengh adaptasi mnuju listrik? hbis itu era full listrik?",Netral
Pengen nanya apa kita2 keutungan ganti mbil dengan mobil listrika mas ? Sedangkan mahal juga . Apa pmerintah mau mngurangij impor bahan bakar  karena kita punya batre diii do ?,Netral
"Ya klo perusahaan besar ,tinggal bikin pabrik lagi ,yg khusus memproduksi mobil listrik ,jadi ada 2 pabrik ,mobil konfensional dan .mobil listrik ,",Netral
"Gak mgkin lah di larang di tahun 2030, tahun 2023 penjualan mobil baru berbahan bakar bensin dan solar masih tinggi, mgkin mobil2 tahun lama yg akan di stop perlahan",Negatif
"Ditanya seberapa siap.?!, Wow ... Beeerattttt ferguso. ! Contoh : apalagi bwt toyota. SEBERAT MENINGGALKAN KENANGAN MANTAN. Miliaran dolar untuk riset dan pengembangan combustion engine, kemudian harus berakhir di foto romantika.",Negatif
Tenang aja Indonesia 2100 masih lama ??,Negatif
"mobil listrik tidak bisa lepas dari namanya pencemaran...dan lepas dari fosil...cadangan bahan battery juga harus diperhitungkan, sampah battery, kebutuhan listrik...nanti juga akan semakin banyak pemakain batubara yg mengakibatkan polusi..tidak 100 persen mobil listrik ramah lingkungan",Positif
Iya kendaraan listrik tidak 100% ramah lingkungan. Pemerintah harus mulai siap-siap menyediakan tempat daur ulang kendaraan listrik agar tidak mencemari lingkungan,Positif
"Toyota jelas lah, karena yg beli mobil nya lebih melihat mesin dibandingkan user VW, bukan berarti gw bilang mesin VW lebih jelek dibandingkan Toyota neh ??, maksud gw fokus produk nya<br><br>penolakan itu cuma sekedar strategi politis aja, mereka ya sudah riset sebenarnya, akhinya ya mau tidak mau dilaunch. muncul deh Toyota BZ4X ??",Negatif
Apakah raja minyak rela kalo bisnisnya berubah menjadi listrik,Negatif
"gak juga om, mobil fosil akan masih tetap ada, mobil listrik itu adalah hasil propaganda negara eropa barat, negara timur tengah mana ada yang ributin harus pakai mobil listrik.. wkwkwk...<a href=""about:invalid#zCSafez""></a>",Negatif
Mobil Toyota nnt jadi kyk nokia phone .. untk masa depan mobil istik harus biar gak pollution bebas asap dunia,Positif
"Pasar yg menentukan, alangkah bijak kalo konsumen bisa cerdas, harus ingat macet bukan hanya di jalan raya, tapi sudah sampai di pengisian bahan bakar, mobil listrik mungkin bisa jd alternative seperti mobil diesel, tapi memang diesel masih lebih teruji di banding listrik, soal teknologi tetap aja ke pilihan konsumen dan pengamat otomotif, soal harga ya pasti di tangan produsen.",Positif
Jangan bicara mobil listrik...kita sedang mengobarkan  agama....kita akan kembali 100 tahun jaman nabi,Netral
"2022.analisa saya 2030. Harga mobil motor bensin murah. bensin nya bakal mahal 80% , mobil motor listrik. Sudah bekerja sama dengan BUMN yg di untungkan adalaH PLN, untuk biaya/harga Normatif. seperti harga ekonomi sekarang.",Netral
Ga mungkin 100% dilarang,Negatif
"Tapi kalo ganti baterai 6 tahun sekali dg biaya RATUSAN JUTA.. Tentu Gak efisien di kantong.. Karena harga baterai nya 60% dari harga mobil..<br>Dan juga kalo skrg biaya listrik murah, bisa jadi akan naik drastis ketika lebih banyak pengguna mobil listrik.",Negatif
Kenapa mobil listrik gak pakai solar power plant pak? Kenapa malah lebih milih nikel?<br>Nikel yang dipakai bisa ngerusak lingkungan juga gak?,Negatif
ndobolll terus emang uangnya darimana untuk neli mobil..,Negatif
"Mobil listrik lebih merusak lingkungan daripada mobil fosil. Itu kan kata mereka.<br>Setidaknya, listrik yang dikonsumsi oleh mobil listrik bisa dihasilkan oleh pembangkit bertenaga angin dan air. Memangnya air dan angin bisa diubah menjadi bensin?",Negatif
Kalau mobil listrik banyak pembelinya di indonesia <br><br>mobil konvensional bakal murah bisa 25 sampai 35jutaan,Netral
Indonesia gmna pak?? Apa akan selalu menggunakan mobil konvensional?????,Netral
owh sistem sewa tuh keren,Positif
Kolonial dunia menyadari bhw mereka tidak mempunyai deposit bhn bakar fossil..akhirnya dengan cara keroyokan negara2 miskin bhn bakar fossil buat peraturan pelarangan mobil ber bhn bakar fosil tsb. Anehnya mereka ada di Eropa doang. Cara termudahnya ya membuat rumor energi bebas polusi lah..rumor efek gas kaca dll.. Jangka panjangnya ya kehancuran OPEC harus terwujud...perang Rusia-Ukraina mem buat terlihat hipokritnya negara2 di Eropa ternyata..pakai batu bara..wkwk..,Negatif
"PARAH SI KLO BENER� GK ADA MOBIL BAHAN BAKAR BENSIN,SAYA SEKOLAH DI STM BARU KELAS 11,BLM JUGA JADI MEKANIK MASA MOBIL MASA DEPAN AKAN BERUBAH MENJADI LISTRIK, HARUS SAYA KUASAAN SI LISTRIK BUAT MASA DEPAN",Netral
"2030 kelamaan , mestix mulai sekarang peralihan bertahap. Dan mencapai target 2030.",Positif
Miris kalo channel joget2 gak jelas dan gosip rumah tangga artis lebih rame dari yg begini,Negatif
Itu tidak berlaku di Indonesia...Wak waak,Negatif
jgn lupa om...saya ingin melihat event race segala merek mobil listrik yg siap uji ketahanan di sirkuit balapan....klu sudah ada mungkin sya akan beli dongsss...beralih ke mobil listrik..,Positif
Ada tuh kayak di jakarta yg e sirkuit,Netral
Penjualan Toyota akan longsor di era EV.,Negatif
"Utk merek merek yg produksinya agak kecil akan lebih mudah utk tranformasi tapi utk yg produksi nya sudah sangat banyak pasti akan susah,ini adalah kesempatan indonesia utk bergerak cepat, jika tidak wasalam.",Positif
Baterai mobil listrik mahal.. hampir setengah harga kendaraan.. Limbah baterai merusak lingkungan hidup,Negatif
"luar biasa,, terima kasih pencerahannya",Positif
"Kena karma ini pabrikan Toyot4, jadi gini, temen gue kerja di salah satu supplier automotive pabrikan Jepang, dia kerja 24jam hampir bund1r stres dan depresi kena maki atasannya tiap hari krn dikejar2 deadline project.",Negatif
"yg menang adalah yg mau sgr bertransformasi dng perubahan yg baru, sdh banyak contohnya, nokia adalah pelajaran yg sangat berharga",Positif
Apakah Toyota akan menjadi next Nokia/Blackberry?,Negatif
Kalau pemerintah serius mau konversi mobil bbm ke mobil listrik maka segera bangun pabrik aki dan peralatan penunjang mobil dan motor listrik. Berikut menyediakan spbl di setiap daerah dari kota sampai desa agar mudah ngecas listrik.,Positif
kira-kira brp banyak org yg  menolak mobil listrik?,Netral
"Diluar negri berlomba-lomba memajukan negaranya, disini berlomba-lomba membangun kekayaan sendiri2. Dengan warga dipajakin dan kualitas dikurangin",Negatif
Untuk kalangan bawah di indonesia tlg mesinnya saja di ganti dg system listrik agar rakyat bsmenjangkau. Dari segi harga.,Positif
Firasat saya NIO akan lebih maju utk mobil listrik global. Utk Indonesia SLIS akan menjadi kuda hitam di roda 2,Positif
"Sy sebagai rakyat sudah paham arah rezim vedeiveh,Dengan adanya perubahan regulasi kelistrikan sy semakin yakin rezim ini ingin menguasai sumber daya listrik karena seperti kita ketahui bisnis minyak SDH dikuasai keluarga Cendana ,dan AKR dimiliki SBY , LPG dikuasai group Kalla milk Yusuf Kalla, dengan mereka bermain di energi listrik tujuannya satu mematikan bisnis para musuh2 abadi politik mereka, arah mereka mengganti semua sumber energi menggunakan listrik Krn mereka SDH kuasai mafia kelistrikan dan saat listrik SDH masuk ke rakyat maka harganya pun pasti akan sangat tinggi Krn tdk adanya subsidi ,dan satu lagi demi melanggengkan kekuasaan bila mereka menguasai sumber energi listrik, Krn sumber energi listriklah musuh2 politik mereka belum menyentuh bisnis ini ??????",Negatif
Kalau fasilitas dan minat masyarakat naik terhadap mobil listrik... bukan tidak mungkin pelarangan mobil BBM semakin cepat di laksanakan..,Negatif
Pemaksaan dari negara kapitalis !,Negatif
Zamannya transportasi berbasis Rel,Negatif
"Jual beli logam akan ramai nih, pasti rosok mesin akan meluber dmn mana",Negatif
"Mungkin ini alesan nya si bumn merah naikin harga, dan mungkin bumn listrik di 2035 naikin harga listrik per kw/h 18 ribu ????",Negatif
Indonesia hrs dari sekarang beralih ke listrik...krn harga minyak sudah tidak fair lagi..karena rejim mafia minyak global...dikuasai raja2 minyak yg menentukan harga minyak bukan pasar lagi..disisi lain rejim mafia dollar meruntuhkan nilai tukar rupiah thd dollar sempurna..indonesia hrs keluar dr cengkramsn n jebakan mafia global...saatnya solusi..kendaraann listrik murah..pemerintah n rakyat jangan buta n tuli soal ini..kalo tidak indonesia akan kolaps seperti srilanka...krn kendaraan bensin jutaan keluar dr dealer tiap tahunnya..berbahaya!!,Positif
"Mobil listrik ada kelemahannya yaitu baterainya......nanti pasti banyak protes baterai soak padahal.....????????<br><br>Tapi ada 1hal yang seharusnya dilarang yaitu pesawat bermesin jet dan segala jenis rocket yang berbahan bakar cairan untuk menghasilkan daya dorong, ini yang harus dilarang kecuali berbahan bakar hydrogen murni berasal dari listrik????????",Negatif
Hanya salut pada Hyundai yg sudah lama memulai sebelum bbm naik. Bahkan dibuatnyapun di indonesia. Kayak ioniq 5 misalnya.. perusahaan raksasa yg lain masih mikir mikir???,Negatif
"Seandainya nanti mobil listrik sudah mendominasi, let say 90% lebih pengguna mobil adalah mobil listrik, apakah mobil konven akan di ""convert"" jadi mobil listrik? Atau terbengkalai begitu aja?",Netral
Punah pertamina :v dan setiap rumah punya plts sendiri bangkrut negara,Negatif
wah kapan Indonesia ini.....<br>atau cma mau beli aja  ya....????,Negatif
Tidak masuk akal Sehat utk melarang mob bensin karena jumlah mob itu jutaan tetapi kalau hanya dijual mahal bensin utk rakyat / umum sedangkan harga listrik lebih murah Tetapi jangan lupa bhw Listrikpun kini mahal mungkin nanti kembaki masa era 40-50 yg punya mob itu hanya orang2 kaya belaka,Negatif
Maaf prof sya penasaran aja dibayar brp?,Negatif
Bos bengkel bilike wait and see liat aja bagaimana kedepannya.,Negatif
